{
  "spec_version": "1",
  "mark": "OFFICE-L1",
  "units": "mm",
  "storey": { "name": "Level 1", "elevation_mm": 0, "floor_to_floor_mm": 3600 },
  "rooms": [
    { "name": "Open plan office", "kind": "room", "use": "Office",
      "outline": { "type": "rectangle", "x_mm": 0, "y_mm": 0, "width_mm": 12000, "depth_mm": 9000 }, "height_mm": 2700, "ceiling_void_mm": 600 },
    { "name": "Meeting room 1", "kind": "room", "use": "Office",
      "outline": { "type": "rectangle", "x_mm": 12000, "y_mm": 0, "width_mm": 5000, "depth_mm": 4000 }, "height_mm": 2700, "ceiling_void_mm": 600 },
    { "name": "Server room", "kind": "room", "use": "Equipment",
      "outline": { "type": "rectangle", "x_mm": 12000, "y_mm": 4000, "width_mm": 4000, "depth_mm": 3000 }, "height_mm": 2700 }
  ],
  "notes": "Synthetic example, not a real building"
}
